{
  "run_id": "1dfb7850-2cdd-5dd0-9cd5-dd7758d19439",
  "version": "v0.1",
  "symbol": "GBPUSD",
  "start_date": "2026-01-13",
  "end_date": "2026-01-17",
  "mode": "fail",
  "compare_tv": false,
  "b_block_count": 1,
  "c1_row_count": 1,
  "c2_row_count": 1,
  "coverage_parity": true,
  "c1_duplicates": 0,
  "c2_duplicates": 0,
  "c1_null_rates": {
    "range": 0.0,
    "body": 0.0,
    "direction": 0.0,
    "ret": 0.0,
    "logret": 0.0,
    "body_ratio": 0.0,
    "close_pos": 0.0,
    "upper_wick": 0.0,
    "lower_wick": 0.0,
    "clv": 0.0,
    "range_zero": 0.0,
    "inputs_valid": 0.0
  },
  "c2_null_rates": {
    "gap": 0.0,
    "took_prev_high": 0.0,
    "took_prev_low": 0.0,
    "sess_high": 0.0,
    "sess_low": 0.0,
    "dist_sess_high": 0.0,
    "dist_sess_low": 0.0,
    "roll_avg_range_12": 0.0,
    "roll_std_logret_12": 0.0,
    "range_z_12": 0.0,
    "hh_12": 0.0,
    "ll_12": 0.0,
    "rd_hi": 0.0,
    "rd_lo": 0.0,
    "rd_mid": 0.0,
    "prev_block_exists": 0.0,
    "sess_block_count": 0.0,
    "roll_12_count": 0.0,
    "rd_count": 0.0
  },
  "c2_window_spec_valid": true,
  "c2_window_spec_errors": [],
  "determinism_sample_size": 1,
  "determinism_mismatches": 0,
  "determinism_details": [],
  "tv_comparison_enabled": false,
  "tv_reference_available": false,
  "tv_matched_blocks": 0,
  "tv_diff_summary": {},
  "tv_top_mismatches": [],
  "errors": [],
  "warnings": [],
  "status": "PASS"
}